<?xml version="1.0"?>
<xs:schema xmlns:xs="http://www.w3.org/2001/XMLSchema" version="0.1" xml:lang="es">
    <xs:element name="Clientes">
        <xs:complexType>
            <xs:sequence>
                <xs:element name="sede" maxOccurs="unbounded">
                    <xs:complexType>
                        <xs:sequence>
                            <xs:element name="codigo_sede" type="xs:string"/>
                            <xs:element name="empleado" maxOccurs="unbounded">
                                <xs:complexType>
                                    <xs:sequence>
                                        <xs:element name="nombre" type="xs:string"/>
                                        <xs:element name="apellido" type="xs:string"/>
                                    </xs:sequence>
                                </xs:complexType>
                            </xs:element>
                            <xs:element name="fecha" maxOccurs="unbounded">
                                <xs:complexType>
                                    <xs:sequence>
                                        <xs:element name="dia" type="xs:string"/>
                                        <xs:element name="mes" type="xs:string"/>
                                        <xs:element name="año" type="xs:string"/>
                                    </xs:sequence>
                                </xs:complexType>
                            </xs:element>
                            <xs:element name="descripcion" type="xs:string"/>
                            <xs:element name="cliente" maxOccurs="unbounded">
                                <xs:complexType>
                                    <xs:sequence>
                                        <xs:element name="codigo_cliente" type="xs:string"/>
                                        <xs:element name="numero_viviendas" type="xs:string"/>
                                        <xs:element name="coste_viviendas" type="xs:string"/>
                                        <xs:element name="resumen_viviendas" type="xs:string"/>
                                        <xs:element name="plazo_alta" maxOccurs="unbounded">
                                            <xs:complexType>
                                                <xs:sequence>
                                                    <xs:element name="dia" type="xs:string"/>
                                                    <xs:element name="mes" type="xs:string"/>
                                                    <xs:element name="año" type="xs:string"/>
                                                </xs:sequence>
                                            </xs:complexType>
                                        </xs:element>
                                    </xs:sequence>
                                </xs:complexType>
                            </xs:element>
                        </xs:sequence>
                    </xs:complexType>
                </xs:element>                
            </xs:sequence>
        </xs:complexType>
    </xs:element>
</xs:schema> 